Title,Website,Link,Domain,Date
JavaScript is no longer the favorite programming language for ...,TechRadar,https://www.techradar.com/news/javascript-no-longer-the-favorite-language-among-developers,www.techradar.com,2022-09-19
Javascript Redirects & SEO: When & How To Use Them,Search Engine Journal,https://www.searchenginejournal.com/javascript-redirects-for-seo/462072/,www.searchenginejournal.com,2022-09-19
Basics Of JavaScript SEO For Ecommerce: What You Need To ...,Search Engine Journal,https://www.searchenginejournal.com/basics-of-javascript-seo-for-ecommerce/463663/,www.searchenginejournal.com,2022-09-19
How to Convert HTML to an Image in JavaScript,MakeUseOf,https://www.makeuseof.com/html-image-convert-javascript/,www.makeuseof.com,2022-09-19
The seventh way to call a JavaScript function without ...,PortSwigger,https://portswigger.net/research/the-seventh-way-to-call-a-javascript-function-without-parentheses,portswigger.net,2022-09-19
Creating a Wordle with TDD in Javascript,HackerNoon,https://hackernoon.com/creating-a-wordle-with-tdd-in-javascript,hackernoon.com,2022-09-19
A Guide to Rounding Numbers in JavaScript,SitePoint,https://www.sitepoint.com/rounding-numbers-javascript/,www.sitepoint.com,2022-09-19
Quick Tip: How to Transform the Character Case of a String in ...,SitePoint,https://www.sitepoint.com/transform-string-character-case-javascript/,www.sitepoint.com,2022-09-19
MemLab: An open source framework for finding JavaScript ...,Engineering at Meta,https://engineering.fb.com/2022/09/12/open-source/memlab/,engineering.fb.com,2022-09-19
Quick Tip: How to Split a String into Substrings in JavaScript,SitePoint,https://www.sitepoint.com/string-substrings-javascript/,www.sitepoint.com,2022-09-19
